{
  "schema": "xueness.acceptance-results.v1",
  "round": "F00.04",
  "recordedAt": "2026-10-24T04:40:00+00:00",
  "recordedBy": "ZCode (GLM-5.3 · Max)",
  "records": [
    {
      "sampleId": "S-TOOL-03A",
      "contractId": "C-TOOL-03",
      "mode": "offline",
      "verdict": "fail",
      "verdictBasis": "违反『模型可用一个通用搜索工具按 query 检索启用插件的工具目录并得到引用』：执行器不存在，调用结算 plugin_disabled（复现 R01 confirmed_broken_transfer_f02，复现成功≠接通）",
      "evidence": {
        "command": "node docs/audits/20261024/acceptance-harness/scripts/repro-tool-search.ts",
        "exitCode": 0,
        "keyOutput": [
          "[1] providers-registered tool names: [\"tool_result_read\"]",
          "[2] ownerOf('tool_search'): null",
          "[3] model-visible request tool names exclude tool_search: [\"tool_result_read\"]",
          "[4] model calls tool_search -> {\"ok\":false,\"error\":\"plugin disabled\",\"error_code\":\"plugin_disabled\"}"
        ],
        "sourceAnchors": ["ts/plugins/providers/src/result-tool.ts:64-77", "ts/packages/agent/src/tools.ts:54-57", "ts/plugins/providers/src/runtime-tools.ts:16-40"],
        "corroboratingTests": ["F00.02-result.md §3（同形状隔离复现 [1]-[4]）"],
        "artifacts": []
      },
      "blocker": "",
      "recordedAt": "2026-10-24T04:40:00+00:00",
      "notes": "F02.02 落地后重跑本样本；脚本会因注册形状变化而 exit 1 提示重估。"
    },
    {
      "sampleId": "S-TOOL-05A",
      "contractId": "C-TOOL-05",
      "mode": "offline",
      "verdict": "fail",
      "verdictBasis": "违反『工具发现跨轮持久并在历史/压缩恢复中投影回请求』：无生产写入者（真实一轮交互后 session.discovered_tools 仍 undefined），无冷恢复 hydrate、无压缩后公告；消费侧完好",
      "evidence": {
        "command": "node docs/audits/20261024/acceptance-harness/scripts/repro-tool-search.ts",
        "exitCode": 0,
        "keyOutput": [
          "[5] selector surfaces injected discovered_tools next turn: [\"network_fetch\",\"tool_result_read\"]",
          "[5b] eviction drops the oldest at maxDiscoveredTools=6 (view itself is sorted): [\"d2\",\"d3\",\"d4\",\"d5\",\"d6\",\"d7\"]",
          "[6] no production writer for discovered_tools: undefined"
        ],
        "sourceAnchors": ["ts/plugins/providers/src/runtime-tools.ts:16-17,37", "ts/packages/providers/src/options.ts:19"],
        "corroboratingTests": ["ts/plugins/providers/test/runtime.test.ts（选择器 fixture 注入用例）", "F00.02-result.md §3 复现 [5]/[6]"],
        "artifacts": []
      },
      "blocker": "",
      "recordedAt": "2026-10-24T04:40:00+00:00",
      "notes": "逐出语义本轮核实：超过 6 个时逐出最旧（选择顺序语义），返回视图按名称排序——F02.04 写入语义须与该约定匹配。"
    },
    {
      "sampleId": "S-MDL-02A",
      "contractId": "C-MDL-02",
      "mode": "offline",
      "verdict": "pass",
      "verdictBasis": "验证『取消不重试；已消费的流式输出片段不重播』：流中取消后 provider 恰调用 1 次、0 条重试排程、无 assistant 消息入历史、租约可再获取",
      "evidence": {
        "command": "node docs/audits/20261024/acceptance-harness/scripts/repro-model-stream.ts (case A)",
        "exitCode": 0,
        "keyOutput": [
          "A1 settles as stopped: stopped",
          "A2 provider called exactly once (cancel is not retried): 1",
          "A3 zero model_retry_scheduled events: 0",
          "A4 no assistant message persisted (committed fragments never replayed into history): 2"
        ],
        "sourceAnchors": ["ts/packages/agent/src/model-request.ts:13-20", "ts/packages/agent/src/stream.ts:116", "ts/packages/agent/src/runner.ts:21-25"],
        "corroboratingTests": ["ts/packages/agent/test/lifecycle.test.ts（stops a stream … resumes without replay）"],
        "artifacts": []
      },
      "recordedAt": "2026-10-24T04:40:00+00:00",
      "notes": ""
    },
    {
      "sampleId": "S-MDL-02B",
      "contractId": "C-MDL-02",
      "mode": "offline",
      "verdict": "pass",
      "verdictBasis": "验证『已消费的流式输出片段不重播』：committed 后的 503 不触发第二次请求（无重放载体）、0 条重试排程、以 ProviderRequestError 拒绝",
      "evidence": {
        "command": "node docs/audits/20261024/acceptance-harness/scripts/repro-model-stream.ts (case B)",
        "exitCode": 0,
        "keyOutput": [
          "B1 provider called exactly once (no second request → no fragment replay): 1",
          "B2 zero model_retry_scheduled events after committed output: 0",
          "B3 failure surfaced as ProviderRequestError (not swallowed, not looped): 503 propagated"
        ],
        "sourceAnchors": ["ts/packages/agent/src/stream.ts:70-80", "ts/packages/agent/src/model-retry.ts:137"],
        "corroboratingTests": ["ts/packages/agent/test/model-retry.test.ts（after committed output 用例）"],
        "artifacts": []
      },
      "recordedAt": "2026-10-24T04:40:00+00:00",
      "notes": ""
    },
    {
      "sampleId": "S-FAIL-01",
      "contractId": "C-MDL-02",
      "mode": "offline",
      "verdict": "pass",
      "verdictBasis": "验证『限流/Retry-After/无输出失败按分类驱动退避』与『同一失败只计一次预算』：503→server_error 重试、429→rate_limited 且 delayMs 荣誉 Retry-After(5ms)、401 非重试单次、空输出恰重试一次、全程单一 requestId",
      "evidence": {
        "command": "node docs/audits/20261024/acceptance-harness/scripts/repro-model-stream.ts (cases C/D/E)",
        "exitCode": 0,
        "keyOutput": [
          "C2 failed events classified server_error then rate_limited: [[1,\"server_error\",true,503],[2,\"rate_limited\",true,429]]",
          "C4 retry delay honors Retry-After (5ms) after the zero-delay first backoff: [[1,2,0,\"server_error\"],[2,3,5,\"rate_limited\"]]",
          "C5 one requestId across the whole request lifecycle (failure counted against one budget): 1",
          "D2 classified as non-retryable: [false]",
          "E1 empty completion retried exactly once then completed: calls=2 status=completed"
        ],
        "sourceAnchors": ["ts/packages/providers/src/failure-codes.ts:8-65", "ts/packages/agent/src/model-retry.ts:129-154", "ts/packages/agent/src/empty-completion.ts"],
        "corroboratingTests": ["ts/packages/agent/test/model-retry.test.ts（同事件序列基线）"],
        "artifacts": []
      },
      "recordedAt": "2026-10-24T04:40:00+00:00",
      "notes": "C-TOOL-06（排队感知 ToolDeadline）仅登记挂点：model_request_queued/admitted 事件与 queuedMs 已存在（model-retry.ts:89-93），未实现 per-tool deadline，F02.05 验收。"
    },
    {
      "sampleId": "S-WFL-05A",
      "contractId": "C-WFL-05",
      "mode": "offline",
      "verdict": "pass",
      "verdictBasis": "验证『运行收尾受租约保护不被并发装配打断』的可离线子句：并发发布者使陈旧运行以 BlockingIOError 拒绝（0 请求/0 副作用/0 生命周期钩子、磁盘字节与发布者一致、租约可再获取）；无租约时 close 钩子不执行、文件字节不变",
      "evidence": {
        "command": "node docs/audits/20261024/acceptance-harness/scripts/probe-lease-drain.ts",
        "exitCode": 0,
        "keyOutput": [
          "P2 no model request, no tool effect, no lifecycle hooks: {\"requests\":0,\"effects\":0,\"before\":0,\"closed\":0}",
          "P3 on-disk bytes equal the concurrent publisher's version (stale run did not overwrite): 901 bytes",
          "Q2 close hook never ran (no cleanup write without owning the lease): {\"closed\":0,\"requests\":0,\"effects\":0}",
          "Q3 session file unchanged byte-for-byte: 686 bytes"
        ],
        "sourceAnchors": ["ts/packages/sessions/src/store.ts:119-122", "ts/packages/agent/src/runner.ts:57-61"],
        "corroboratingTests": ["ts/packages/agent/test/runner-lease.test.ts（同形状两用例）", "ts/plugins/workflows/test/dynamic-runs.test.ts（幂等 cancel；drain 相邻覆盖）"],
        "artifacts": []
      },
      "recordedAt": "2026-10-24T04:40:00+00:00",
      "notes": "结论限定：仅覆盖单机跨进程租约排他与无租约不收尾；收尾期竞态/宿主崩溃恢复见 S-WFL-05B（blocked）。C-WFL-05 整行仍为 unverified（D07）。"
    },
    {
      "sampleId": "S-WFL-05B",
      "contractId": "C-WFL-05",
      "mode": "offline",
      "verdict": "blocked",
      "verdictBasis": "『宿主关闭/禁用时 drain 在途工作而不是丢弃』的收尾期竞态探针只有设计稿：需要可注入收尾阶段故障的宿主试验台与上游时序锚点，均不在本机",
      "evidence": {
        "command": "not executed (probe design)",
        "keyOutput": [],
        "sourceAnchors": ["docs/audits/20261024/gap-register.json D07"],
        "corroboratingTests": ["ts/plugins/workflows/test/dynamic-runs.test.ts（幂等 cancel）", "docs/engine-z6.md（host.close 对在途请求取消且无重放）"],
        "artifacts": []
      },
      "blocker": "无可注入收尾阶段故障的宿主试验台；上游 residency-lease 对 detached runner 的时序锚点未采集（本机无上游树）。F03.06 按样本设计实现后执行。",
      "recordedAt": "2026-10-24T04:40:00+00:00",
      "notes": "探针设计见 samples.json S-WFL-05B steps。"
    },
    {
      "sampleId": "S-MDL-01L",
      "contractId": "C-MDL-01",
      "mode": "live_model",
      "verdict": "not_run",
      "verdictBasis": "C-MDL-01 逐字段对照需要真实模型响应（fixture 回放不能替代）；无费用授权不调用",
      "evidence": {
        "command": "not executed (live model pending authorization)",
        "keyOutput": [],
        "sourceAnchors": ["ts/packages/providers/src/metadata.ts:7-12,35,57"],
        "corroboratingTests": [],
        "artifacts": []
      },
      "blocker": "无用户费用授权（F00.04 默认离线）。授权后按 acceptance-harness.md『真实模型验证』节执行并补 costAuth。",
      "recordedAt": "2026-10-24T04:40:00+00:00",
      "notes": "C-MDL-01 在契约表保持 unverified，不因本记录变好或变坏。"
    },
    {
      "sampleId": "S-MDL-02L",
      "contractId": "C-MDL-02",
      "mode": "live_model",
      "verdict": "not_run",
      "verdictBasis": "真实流取消/断连边界需要真实模型与可控断连代理；无费用授权不调用",
      "evidence": {
        "command": "not executed (live model pending authorization)",
        "keyOutput": [],
        "sourceAnchors": ["ts/packages/agent/src/model-request.ts:89-108"],
        "corroboratingTests": [],
        "artifacts": []
      },
      "blocker": "无用户费用授权（F00.04 默认离线）。",
      "recordedAt": "2026-10-24T04:40:00+00:00",
      "notes": "离线子句已由 S-MDL-02A/B 与 S-FAIL-01 覆盖；本样本只补真实传输层形态。"
    }
  ]
}
